priority,source,item,species_count,example_species,type_voucher,current_status,recommended_action
1,unresolved_prefix,LSNSAU,1,Presbytis_bicolor,LSNSAU SD 16,needs_primary_literature,"Known from Aimi & Bakar (1992), Primates 33:191-206, as Presbytis melalophos bicolor holotype LSNSAU SD 16. Authorship links Kyoto University and Andalas University, but accessible sources did not expand LSNSAU; likely requires the full article/PDF or contact with Andalas University Museum Zoologi or Kyoto PRI."
2,standalone_zero_match_metadata,ACUNHC,0,,,standalone_zero_match,retain: Valid institution metadata for Abilene Christian University; retained for external alignment even though no MDD v2.4 voucher currently uses ACUNHC.
2,standalone_zero_match_metadata,CUMV,0,,,standalone_zero_match,retain: Cornell University Museum of Vertebrates is a standard vertebrate collection code; retained for future voucher matches and cross-database use.
2,standalone_zero_match_metadata,DZSJRP,0,,,standalone_zero_match,retain: Universidade Estadual Paulista campus/repository prefix; retained for future Brazilian type vouchers that may enter MDD.
2,standalone_zero_match_metadata,GEC,0,,,standalone_zero_match,retain: Historical Cuban scientific group code already present in metadata; retained pending future voucher matches rather than removed speculatively.
2,standalone_zero_match_metadata,MNHNC,0,,,standalone_zero_match,retain: National Museum of Natural History of Cuba; retained separately from MNHN Paris and other MNHN* variants for geographic clarity.
2,standalone_zero_match_metadata,NMSL,0,,,standalone_zero_match,retain: National Museum of Sri Lanka code; retained for future South Asian type vouchers.
2,standalone_zero_match_metadata,SNMB,0,,,standalone_zero_match,retain: Staatliches Naturhistorisches Museum Braunschweig; retained as a valid European museum code.
